{"allowed_commit_behavior":"validated local commit; risk-gated merge","allowed_task":"Add the smallest synthetic regression in tests/redaction/test_docx_package.py for the previously untested WordprocessingML hidden visibility elements w:vanish and w:webHidden. Prove both synthetic elements are rejected with UnsupportedDocxFeatureError and that no synthetic sensitive value is echoed. Change tests only; preserve every production and safety boundary.","allowed_validation":["focused-docx-package","full-pytest","hidden-element-regression-shape"],"allowed_worktree":"C:\\Users\\sizhe\\Documents\\model-tier-router-dogfood-worktrees\\qwen-redaction-standalone\\qwen-docx-hidden-elements-r1-r2\\router_auto-2","baseline_head":"bbb1bd68882aeb735f29c448b00a5c21783b355f","case_id":"qwen-docx-hidden-elements-r1","child_writable_roots":["C:\\Users\\sizhe\\Documents\\model-tier-router-dogfood-worktrees\\qwen-redaction-standalone\\qwen-docx-hidden-elements-r1-r2\\router_auto-2"],"contract_id":"MODEL_TIER_ROUTER_DOGFOOD_R2_HARNESS_REPAIR_AND_TWO_LANE_REAL_RUNS","execution_authority_source":"current explicit user authorization for MODEL_TIER_ROUTER_DOGFOOD_R2","external_push_authorized":false,"known_external_sessions_declared_active":true,"router_authorized_write_scope":[],"router_execution_authorized":false,"schema_version":"1.0.0","target_repository":"C:\\Users\\sizhe\\Documents\\qwen-redaction-standalone","worktree_local_schema_path":"C:\\Users\\sizhe\\Documents\\model-tier-router-dogfood-worktrees\\qwen-redaction-standalone\\qwen-docx-hidden-elements-r1-r2\\router_auto-2\\.mtr-dogfood-r2\\execution-result.schema.json"}
