{"allowed_commit_behavior":"validated local commit; risk-gated merge","allowed_task":"Add docs/dogfood-automation.md and tests/integrations/test_dogfood_automation.py. The guide and non-executing integration test must demonstrate a private executor consuming an advisory assess result while preserving execution_authorized=false and authorized_write_scope=[], requiring status=recommended, and treating the selected logical profile as a recommendation that is mapped and executed only under separate current user authority. Do not add provider calls, model names, network access, execution dispatch, or production behavior changes.","allowed_validation":["focused-dogfood-integration","full-unittest","guide-contract"],"allowed_worktree":"C:\\Users\\sizhe\\Documents\\model-tier-router-dogfood-worktrees\\model-tier-router\\mtr-docs-private-executor-r1-r2\\router_auto-2","baseline_head":"a455debff9a01faa5481cb8a6ca98e31e29ec52a","case_id":"mtr-docs-private-executor-r1","child_writable_roots":["C:\\Users\\sizhe\\Documents\\model-tier-router-dogfood-worktrees\\model-tier-router\\mtr-docs-private-executor-r1-r2\\router_auto-2"],"contract_id":"MODEL_TIER_ROUTER_DOGFOOD_R2_HARNESS_REPAIR_AND_TWO_LANE_REAL_RUNS","execution_authority_source":"current explicit user authorization for MODEL_TIER_ROUTER_DOGFOOD_R2","external_push_authorized":false,"known_external_sessions_declared_active":true,"router_authorized_write_scope":[],"router_execution_authorized":false,"schema_version":"1.0.0","target_repository":"C:\\Users\\sizhe\\Documents\\model-tier-router","worktree_local_schema_path":"C:\\Users\\sizhe\\Documents\\model-tier-router-dogfood-worktrees\\model-tier-router\\mtr-docs-private-executor-r1-r2\\router_auto-2\\.mtr-dogfood-r2\\execution-result.schema.json"}
